### ISSUE TITLE
[Agent] Frequent degrade from missing last check-in

### ISSUE THREAD

**Issue by gogochan** [elastic/beats#21598]
On `7.9.2` I'm observing periodic `degrade` from missing last check-in on Fleet.

![image](https://user-images.githubusercontent.com/5281995/95249598-ec1b0b80-07e6-11eb-8814-9e78bceb9d73.png)

Please include configurations and logs if available.

#### Config
[config.txt](https://github.com/elastic/beats/files/5336237/config.txt)
#### Log
[elastic-agent-json.log.gz](https://github.com/elastic/beats/files/5336236/elastic-agent-json.log.gz)

For confirmed bugs, please report:
- Version: 7.9.2
- Operating System: Linux/Windows
- Discuss Forum URL: https://discuss.elastic.co/t/elastic-endpoint-security-with-elastic-agent/249804/4
- Steps to Reproduce: Install Elastic Agent on a linux box
Wait until Agent report degrade.

I first thought that this was possibly with Elastic-Endpoint only, so I uninstalled the Elastic-Endpoint. But I'm still observing the behavior with other Beat.

**Comment by ph** [comment]
@blakerouse Could you investigate that case?

**Comment by blakerouse** [comment]
@gogochan Seems that metricbeat is not checking in as often as it should. Wonder if its because its under heavy load and missing check-in or if its something else.

Need to view the metricbeat logs. Can you tar up the entire Elastic Agent `logs` directory?

**Comment by gogochan** [comment]
The machine actually remains very idle most of the time.
[logs.tar.gz](https://github.com/elastic/beats/files/5336626/logs.tar.gz)

**Comment by gogochan** [comment]
It also happens with Elastic-Endpoint on a different box.

**Comment by gogochan** [comment]
Just wanted to share some observation from my end. While doing a TCP dump on GRPC connection between the Agent and the Endpoint running on my machine, I saw a TCP FIN followed by RESET from the Agent side. Note that Endpoint kept on sending heartbeat, the payload with `length 4440`. I do not have any logging printed from Agent.

## TCPdump
```
16:42:47.719995 IP localhost.46638 > localhost.6789: Flags [P.], seq 130141:134581, ack 2036, win 512, options [nop,nop,TS val 1212397989 ecr 1212375815], length 4440
16:42:47.720003 IP localhost.6789 > localhost.46638: Flags [.], ack 134581, win 492, options [nop,nop,TS val 1212397989 ecr 1212397989], length 0
16:42:47.720106 IP localhost.6789 > localhost.46638: Flags [P.], seq 2036:2095, ack 134581, win 512, options [nop,nop,TS val 1212397989 ecr 1212397989], length 59
16:42:47.720185 IP localhost.46638 > localhost.6789: Flags [P.], seq 134581:134627, ack 2095, win 512, options [nop,nop,TS val 1212397990 ecr 1212397989], length 46
16:42:47.762886 IP localhost.6789 > localhost.46638: Flags [.], ack 134627, win 512, options [nop,nop,TS val 1212398037 ecr 1212397990], length 0
16:43:06.314400 IP localhost.6789 > localhost.46638: Flags [.], ack 134627, win 512, options [nop,nop,TS val 1212414668 ecr 1212397990], length 0
16:43:06.314416 IP localhost.46638 > localhost.6789: Flags [.], ack 2095, win 512, options [nop,nop,TS val 1212414668 ecr 1212398037], length 0
16:43:07.720864 IP localhost.46638 > localhost.6789: Flags [P.], seq 134627:139067, ack 2095, win 512, options [nop,nop,TS val 1212416231 ecr 1212398037], length 4440
16:43:07.720883 IP localhost.6789 > localhost.46638: Flags [.], ack 139067, win 492, options [nop,nop,TS val 1212416231 ecr 1212416231], length 0
16:43:07.721020 IP localhost.6789 > localhost.46638: Flags [P.], seq 2095:2154, ack 139067, win 512, options [nop,nop,TS val 1212416231 ecr 1212416231], length 59
16:43:07.721135 IP localhost.46638 > localhost.6789: Flags [P.], seq 139067:139113, ack 2154, win 512, options [nop,nop,TS val 1212416231 ecr 1212416231], length 46
16:43:07.762392 IP localhost.6789 > localhost.46638: Flags [.], ack 139113, win 512, options [nop,nop,TS val 1212416277 ecr 1212416231], length 0
16:43:12.075695 IP localhost.46638 > localhost.6789: Flags [P.], seq 139113:139159, ack 2154, win 512, options [nop,nop,TS val 1212421069 ecr 1212416277], length 46
16:43:12.075706 IP localhost.6789 > localhost.46638: Flags [.], ack 139159, win 512, options [nop,nop,TS val 1212421069 ecr 1212421069], length 0
16:43:12.075827 IP localhost.6789 > localhost.46638: Flags [P.], seq 2154:2231, ack 139159, win 512, options [nop,nop,TS val 1212421070 ecr 1212421069], length 77
16:43:12.075865 IP localhost.6789 > localhost.46638: Flags [P.], seq 2231:2262, ack 139159, win 512, options [nop,nop,TS val 1212421070 ecr 1212421069], length 31
16:43:12.075901 IP localhost.6789 > localhost.46638: Flags [F.], seq 2262, ack 139159, win 512, options [nop,nop,TS val 1212421070 ecr 1212421069], length 0
16:43:12.075934 IP localhost.46638 > localhost.6789: Flags [.], ack 2263, win 512, options [nop,nop,TS val 1212421070 ecr 1212421070], length 0
16:43:12.076355 IP localhost.46638 > localhost.6789: Flags [P.], seq 139159:139214, ack 2263, win 512, options [nop,nop,TS val 1212421070 ecr 1212421070], length 55
16:43:12.076360 IP localhost.6789 > localhost.46638: Flags [R], seq 3061686083, win 0, length 0
```

## Agent Log
```
{"log.level":"debug","@timestamp":"2020-10-14T16:42:44.069Z","log.origin":{"file.name":"kibana/client.go","file.line":170},"message":"Request method: POST, path: /api/ingest_manager/fleet/agents/ea9635b6-c6d0-4107-8dc3-e0343f0f2ad1/checkin","ecs.version":"1.5.0"}
{"log.level":"info","@timestamp":"2020-10-14T16:42:57.744Z","log.origin":{"file.name":"log/reporter.go","file.line":40},"message":"2020-10-14T16:42:57Z: type: 'STATE': sub_type: 'RUNNING' message: Application: filebeat--7.9.2[ea9635b6-c6d0-4107-8dc3-e0343f0f2ad1]: State changed to DEGRADED: Missed last check-in","ecs.version":"1.5.0"}
{"log.level":"info","@timestamp":"2020-10-14T16:42:58.237Z","log.origin":{"file.name":"log/reporter.go","file.line":40},"message":"2020-10-14T16:42:58Z: type: 'STATE': sub_type: 'RUNNING' message: Application: filebeat--7.9.2[ea9635b6-c6d0-4107-8dc3-e0343f0f2ad1]: State changed to RUNNING: Running","ecs.version":"1.5.0"}
{"log.level":"info","@timestamp":"2020-10-14T16:43:31.328Z","log.origin":{"file.name":"log/reporter.go","file.line":40},"message":"2020-10-14T16:43:31Z: type: 'STATE': sub_type: 'RUNNING' message: Application: filebeat--7.9.2[ea9635b6-c6d0-4107-8dc3-e0343f0f2ad1]: State changed to DEGRADED: Missed last check-in","ecs.version":"1.5.0"}
{"log.level":"info","@timestamp":"2020-10-14T16:43:31.825Z","log.origin":{"file.name":"log/reporter.go","file.line":40},"message":"2020-10-14T16:43:31Z: type: 'STATE': sub_type: 'RUNNING' message: Application: filebeat--7.9.2[ea9635b6-c6d0-4107-8dc3-e0343f0f2ad1]: State changed to RUNNING: Running","ecs.version":"1.5.0"}
{"log.level":"debug","@timestamp":"2020-10-14T16:43:46.958Z","log.origin":{"file.name":"application/action_dispatcher.go","file.line":77},"message":"No action to dispatch","ecs.version":"1.5.0"}
{"log.level":"debug","@timestamp":"2020-10-14T16:43:46.958Z","log.origin":{"file.name":"application/fleet_gateway.go","file.line":162},"message":"FleetGateway is sleeping, next update in 1s","ecs.version":"1.5.0"}
{"log.level":"debug","@timestamp":"2020-10-14T16:43:48.452Z","log.origin":{"file.name":"application/fleet_gateway.go","file.line":142},"message":"FleetGateway calling Checkin API","ecs.version":"1.5.0"}
{"log.level":"debug","@timestamp":"2020-10-14T16:43:48.452Z","log.origin":{"file.name":"kibana/client.go","file.line":170},"message":"Request method: POST, path: /api/ingest_manager/fleet/agents/ea9635b6-c6d0-4107-8dc3-e0343f0f2ad1/checkin","ecs.version":"1.5.0"}
{"log.level":"info","@timestamp":"2020-10-14T16:44:34.917Z","log.origin":{"file.name":"log/reporter.go","file.line":40},"message":"2020-10-14T16:44:34Z: type: 'STATE': sub_type: 'RUNNING' message: Application: filebeat--7.9.2[ea9635b6-c6d0-4107-8dc3-e0343f0f2ad1]: State changed to DEGRADED: Missed last check-in","ecs.version":"1.5.0"}
```

**Comment by EricDavisX** [comment]
There was some discussion on this today and we're still researching.

**Comment by EricDavisX** [comment]
there were other issues that came out of our research, and we never did track down how this would be happening.  https://github.com/elastic/beats/issues/23518 this issue is fixed, as relates - we may have fixed this back during the early 7.1o cycle after 7.9 and not closed the issue.

**Comment by blakerouse** [comment]
After looking into this more, it seems to happen more with my VM than on my physical machine. I think this all comes down to timing. The grace period was set to only 2 seconds, which in a compute is a long time, but in a VM with coordination occurring across multiple VM's, time splicing, go routines, and threads from Endpoint it seems like that 2 seconds is just not long enough.

I increased the timeout and was un-able to get it to reproduce, at least not yet. So I think the simplest fix in this regard is to increase the grace period from 2 seconds to 30 seconds. Increasing it doesn't really have a large effect on the outcome. If the process is really locked up and not responding it will still miss that time window and not checkin and Agent will do the correct thing to recover from that state.

**Comment by EricDavisX** [comment]
I am not seeing this in latest 7.11+ code, just confirming.  Smoke tests were done over the 7.11 BC4 build that has this code merged
